17:07:29.010942 d6:7b:b0:7a:2e:6d (oui Unknown) > d4:7b:b0:7a:2e:6d (oui Unknown), ethertype Unknown (0x886c), length 196: 
	0x0000:  8001 00e2 0000 1018 0001 0002 0018 0000  ................
	0x0010:  002c 0000 0000 0000 0000 0000 0000 0000  .,..............
	0x0020:  007a 8203 bafb 6774 776c 3000 0000 0000  .z....gtwl0.....
	0x0030:  0000                                     ..
.................,...............z....gtwl0.......
17:07:29.056411 d6:7b:b0:7a:2e:6d (oui Unknown) > d4:7b:b0:7a:2e:6d (oui Unknown), ethertype Unknown (0x886c), length 196: 
	0x0000:  8001 00e2 0000 1018 0001 0002 0018 0000  ................
	0x0010:  002c 0000 0000 0000 0000 0000 0000 0000  .,..............
	0x0020:  007a 8203 bafb 6774 776c 3000 0000 0000  .z....gtwl0.....
	0x0030:  0000                                     ..
.................,...............z....gtwl0.......
17:07:29.430265 d6:7b:b0:7a:2e:6d (oui Unknown) > d4:7b:b0:7a:2e:6d (oui Unknown), ethertype Unknown (0x886c), length 196: 
	0x0000:  8001 00e2 0000 1018 0001 0002 0018 0000  ................
	0x0010:  002c 0000 0000 0000 0000 0000 0000 0000  .,..............
	0x0020:  007a 8203 bafb 6774 776c 3000 0000 0000  .z....gtwl0.....
	0x0030:  0000                                     ..
.................,...............z....gtwl0.......
17:07:29.476666 d6:7b:b0:7a:2e:6d (oui Unknown) > d4:7b:b0:7a:2e:6d (oui Unknown), ethertype Unknown (0x886c), length 196: 
	0x0000:  8001 00e2 0000 1018 0001 0002 0018 0000  ................
	0x0010:  002c 0000 0000 0000 0000 0000 0000 0000  .,..............
	0x0020:  007a 8203 bafb 6774 776c 3000 0000 0000  .z....gtwl0.....
	0x0030:  0000                                     ..
.................,...............z....gtwl0.......
17:07:32.634305 d6:7b:b0:7a:2e:6d (oui Unknown) > d4:7b:b0:7a:2e:6d (oui Unknown), ethertype Unknown (0x886c), length 187: 
	0x0000:  8001 00d9 0000 1018 0001 0002 0018 0000  ................
	0x0010:  002c 0000 0000 0000 0000 0000 0000 0000  .,..............
	0x0020:  0071 b8c7 5d1a 95a6 776c 3000 0000 0000  .q..]...wl0.....
	0x0030:  0000                                     ..
.................,...............q..]...wl0.......
17:07:32.664529 d6:7b:b0:7a:2e:6d (oui Unknown) > d4:7b:b0:7a:2e:6d (oui Unknown), ethertype Unknown (0x886c), length 187: 
	0x0000:  8001 00d9 0000 1018 0001 0002 0018 0000  ................
	0x0010:  002c 0000 0000 0000 0000 0000 0000 0000  .,..............
	0x0020:  0071 b8c7 5d1a 95a6 776c 3000 0000 0000  .q..]...wl0.....
	0x0030:  0000                                     ..
.................,...............q..]...wl0.......
17:07:32.680763 d6:7b:b0:7a:2e:6d (oui Unknown) > d4:7b:b0:7a:2e:6d (oui Unknown), ethertype Unknown (0x886c), length 187: 
	0x0000:  8001 00d9 0000 1018 0001 0002 0018 0000  ................
	0x0010:  002c 0000 0000 0000 0000 0000 0000 0000  .,..............
	0x0020:  0071 b8c7 5d1a 95a6 776c 3000 0000 0000  .q..]...wl0.....
	0x0030:  0000                                     ..
.................,...............q..]...wl0.......
17:07:32.700234 d6:7b:b0:7a:2e:6d (oui Unknown) > d4:7b:b0:7a:2e:6d (oui Unknown), ethertype Unknown (0x886c), length 187: 
	0x0000:  8001 00d9 0000 1018 0001 0002 0018 0000  ................
	0x0010:  002c 0000 0000 0000 0000 0000 0000 0000  .,..............
	0x0020:  0071 b8c7 5d1a 95a6 776c 3000 0000 0000  .q..]...wl0.....
	0x0030:  0000                                     ..
.................,...............q..]...wl0.......
17:07:32.729917 d6:7b:b0:7a:2e:6d (oui Unknown) > d4:7b:b0:7a:2e:6d (oui Unknown), ethertype Unknown (0x886c), length 187: 
	0x0000:  8001 00d9 0000 1018 0001 0002 0018 0000  ................
	0x0010:  002c 0000 0000 0000 0000 0000 0000 0000  .,..............
	0x0020:  0071 b8c7 5d1a 95a6 776c 3000 0000 0000  .q..]...wl0.....
	0x0030:  0000                                     ..
.................,...............q..]...wl0.......
17:07:32.744172 d6:7b:b0:7a:2e:6d (oui Unknown) > d4:7b:b0:7a:2e:6d (oui Unknown), ethertype Unknown (0x886c), length 187: 
	0x0000:  8001 00d9 0000 1018 0001 0002 0018 0000  ................
	0x0010:  002c 0000 0000 0000 0000 0000 0000 0000  .,..............
	0x0020:  0071 b8c7 5d1a 95a6 776c 3000 0000 0000  .q..]...wl0.....
	0x0030:  0000                                     ..
.................,...............q..]...wl0.......
17:07:32.773123 d6:7b:b0:7a:2e:6d (oui Unknown) > d4:7b:b0:7a:2e:6d (oui Unknown), ethertype Unknown (0x886c), length 187: 
	0x0000:  8001 00d9 0000 1018 0001 0002 0018 0000  ................
	0x0010:  002c 0000 0000 0000 0000 0000 0000 0000  .,..............
	0x0020:  0071 b8c7 5d1a 95a6 776c 3000 0000 0000  .q..]...wl0.....
	0x0030:  0000                                     ..
.................,...............q..]...wl0.......
17:07:32.800095 d6:7b:b0:7a:2e:6d (oui Unknown) > d4:7b:b0:7a:2e:6d (oui Unknown), ethertype Unknown (0x886c), length 187: 
	0x0000:  8001 00d9 0000 1018 0001 0002 0018 0000  ................
	0x0010:  002c 0000 0000 0000 0000 0000 0000 0000  .,..............
	0x0020:  0071 b8c7 5d1a 95a6 776c 3000 0000 0000  .q..]...wl0.....
	0x0030:  0000                                     ..
.................,...............q..]...wl0.......
17:07:32.832814 d6:7b:b0:7a:2e:6d (oui Unknown) > d4:7b:b0:7a:2e:6d (oui Unknown), ethertype Unknown (0x886c), length 187: 
	0x0000:  8001 00d9 0000 1018 0001 0002 0018 0000  ................
	0x0010:  002c 0000 0000 0000 0000 0000 0000 0000  .,..............
	0x0020:  0071 b8c7 5d1a 95a6 776c 3000 0000 0000  .q..]...wl0.....
	0x0030:  0000                                     ..
.................,...............q..]...wl0.......
17:07:32.854118 d6:7b:b0:7a:2e:6d (oui Unknown) > d4:7b:b0:7a:2e:6d (oui Unknown), ethertype Unknown (0x886c), length 187: 
	0x0000:  8001 00d9 0000 1018 0001 0002 0018 0000  ................
	0x0010:  002c 0000 0000 0000 0000 0000 0000 0000  .,..............
	0x0020:  0071 b8c7 5d1a 95a6 776c 3000 0000 0000  .q..]...wl0.....
	0x0030:  0000                                     ..
.................,...............q..]...wl0.......
17:07:33.031677 d6:7b:b0:7a:2e:6d (oui Unknown) > d4:7b:b0:7a:2e:6d (oui Unknown), ethertype Unknown (0x886c), length 187: 
	0x0000:  8001 00d9 0000 1018 0001 0002 0018 0000  ................
	0x0010:  002c 0000 0000 0000 0000 0000 0000 0000  .,..............
	0x0020:  0071 b8c7 5d1a 95a6 776c 3000 0000 0000  .q..]...wl0.....
	0x0030:  0000                                     ..
.................,...............q..]...wl0.......
17:07:33.051721 d6:7b:b0:7a:2e:6d (oui Unknown) > d4:7b:b0:7a:2e:6d (oui Unknown), ethertype Unknown (0x886c), length 187: 
	0x0000:  8001 00d9 0000 1018 0001 0002 0018 0000  ................
	0x0010:  002c 0000 0000 0000 0000 0000 0000 0000  .,..............
	0x0020:  0071 b8c7 5d1a 95a6 776c 3000 0000 0000  .q..]...wl0.....
	0x0030:  0000                                     ..
.................,...............q..]...wl0.......
17:07:33.081209 d6:7b:b0:7a:2e:6d (oui Unknown) > d4:7b:b0:7a:2e:6d (oui Unknown), ethertype Unknown (0x886c), length 187: 
	0x0000:  8001 00d9 0000 1018 0001 0002 0018 0000  ................
	0x0010:  002c 0000 0000 0000 0000 0000 0000 0000  .,..............
	0x0020:  0071 b8c7 5d1a 95a6 776c 3000 0000 0000  .q..]...wl0.....
	0x0030:  0000                                     ..
.................,...............q..]...wl0.......
17:07:33.299462 d6:7b:b0:7a:2e:6d (oui Unknown) > d4:7b:b0:7a:2e:6d (oui Unknown), ethertype Unknown (0x886c), length 200: 
	0x0000:  8001 00e6 0000 1018 0001 0002 0018 0000  ................
	0x0010:  002c 0000 0000 0000 0000 0000 0000 0000  .,..............
	0x0020:  007e 4663 fe3d eb94 776c 3000 0000 0000  .~Fc.=..wl0.....
	0x0030:  0000                                     ..
.................,...............~Fc.=..wl0.......
17:07:33.694736 d6:7b:b0:7a:2e:6d (oui Unknown) > d4:7b:b0:7a:2e:6d (oui Unknown), ethertype Unknown (0x886c), length 200: 
	0x0000:  8001 00e6 0000 1018 0001 0002 0018 0000  ................
	0x0010:  002c 0000 0000 0000 0000 0000 0000 0000  .,..............
	0x0020:  007e 4663 fe3d eb94 776c 3000 0000 0000  .~Fc.=..wl0.....
	0x0030:  0000                                     ..
.................,...............~Fc.=..wl0.......
17:07:33.934882 ARP, Request who-has 172.24.1.1 tell 172.24.1.89, length 28
........p..B.h...Y..........
17:07:33.935109 ARP, Reply 172.24.1.1 is-at d4:7b:b0:7a:2e:6d (oui Unknown), length 28
.........{.z.m....p..B.h...Y
17:07:34.213622 d6:7b:b0:7a:2e:6d (oui Unknown) > d4:7b:b0:7a:2e:6d (oui Unknown), ethertype Unknown (0x886c), length 164: 
	0x0000:  8001 00c2 0000 1018 0001 0002 0018 0000  ................
	0x0010:  002c 0000 0000 0000 0000 0000 0000 0000  .,..............
	0x0020:  005a a0d3 c1c1 99ea 776c 3000 0000 0000  .Z......wl0.....
	0x0030:  0000                                     ..
.................,...............Z......wl0.......
17:07:34.214683 d6:7b:b0:7a:2e:6d (oui Unknown) > d4:7b:b0:7a:2e:6d (oui Unknown), ethertype Unknown (0x886c), length 164: 
	0x0000:  8001 00c2 0000 1018 0001 0002 0018 0000  ................
	0x0010:  002c 0000 0000 0000 0000 0000 0000 0000  .,..............
	0x0020:  005a a0d3 c1c1 99ea 776c 3000 0000 0000  .Z......wl0.....
	0x0030:  0000                                     ..
.................,...............Z......wl0.......
17:07:34.219309 d6:7b:b0:7a:2e:6d (oui Unknown) > d4:7b:b0:7a:2e:6d (oui Unknown), ethertype Unknown (0x886c), length 164: 
	0x0000:  8001 00c2 0000 1018 0001 0002 0018 0000  ................
	0x0010:  002c 0000 0000 0000 0000 0000 0000 0000  .,..............
	0x0020:  005a a0d3 c1c1 99ea 776c 3000 0000 0000  .Z......wl0.....
	0x0030:  0000                                     ..
.................,...............Z......wl0.......
17:07:34.777381 d6:7b:b0:7a:2e:6d (oui Unknown) > d4:7b:b0:7a:2e:6d (oui Unknown), ethertype Unknown (0x886c), length 196: 
	0x0000:  8001 00e2 0000 1018 0001 0002 0018 0000  ................
	0x0010:  002c 0000 0000 0000 0000 0000 0000 0000  .,..............
	0x0020:  007a e6eb 381e c32f 776c 3000 0000 0000  .z..8../wl0.....
	0x0030:  0000                                     ..
.................,...............z..8../wl0.......
17:07:34.878515 d6:7b:b0:7a:2e:6d (oui Unknown) > d4:7b:b0:7a:2e:6d (oui Unknown), ethertype Unknown (0x886c), length 199: 
	0x0000:  8001 00e5 0000 1018 0001 0002 0018 0000  ................
	0x0010:  002c 0000 0000 0000 0000 0000 0000 0000  .,..............
	0x0020:  007d 784b 876f 9b5f 776c 3000 0000 0000  .}xK.o._wl0.....
	0x0030:  0000                                     ..
.................,...............}xK.o._wl0.......
17:07:34.880222 d6:7b:b0:7a:2e:6d (oui Unknown) > d4:7b:b0:7a:2e:6d (oui Unknown), ethertype Unknown (0x886c), length 196: 
	0x0000:  8001 00e2 0000 1018 0001 0002 0018 0000  ................
	0x0010:  002c 0000 0000 0000 0000 0000 0000 0000  .,..............
	0x0020:  007a 784b 876f 9b5f 776c 3000 0000 0000  .zxK.o._wl0.....
	0x0030:  0000                                     ..
.................,...............zxK.o._wl0.......
17:07:34.998458 d6:7b:b0:7a:2e:6d (oui Unknown) > d4:7b:b0:7a:2e:6d (oui Unknown), ethertype Unknown (0x886c), length 203: 
	0x0000:  8001 00e9 0000 1018 0001 0002 0018 0000  ................
	0x0010:  002c 0000 0000 0000 0000 0000 0000 0000  .,..............
	0x0020:  0081 784b 876f 9b5f 776c 3000 0000 0000  ..xK.o._wl0.....
	0x0030:  0000                                     ..
.................,................xK.o._wl0.......
17:07:35.013404 d6:7b:b0:7a:2e:6d (oui Unknown) > d4:7b:b0:7a:2e:6d (oui Unknown), ethertype Unknown (0x886c), length 201: 
	0x0000:  8001 00e7 0000 1018 0001 0002 0018 0000  ................
	0x0010:  002c 0000 0000 0000 0000 0000 0000 0000  .,..............
	0x0020:  007f 784b 876f 9b5f 776c 3000 0000 0000  ..xK.o._wl0.....
	0x0030:  0000                                     ..
.................,................xK.o._wl0.......
17:07:35.014664 d6:7b:b0:7a:2e:6d (oui Unknown) > d4:7b:b0:7a:2e:6d (oui Unknown), ethertype Unknown (0x886c), length 201: 
	0x0000:  8001 00e7 0000 1018 0001 0002 0018 0000  ................
	0x0010:  002c 0000 0000 0000 0000 0000 0000 0000  .,..............
	0x0020:  007f 784b 876f 9b5f 776c 3000 0000 0000  ..xK.o._wl0.....
	0x0030:  0000                                     ..
.................,................xK.o._wl0.......
17:07:35.022370 d6:7b:b0:7a:2e:6d (oui Unknown) > d4:7b:b0:7a:2e:6d (oui Unknown), ethertype Unknown (0x886c), length 206: 
	0x0000:  8001 00ec 0000 1018 0001 0002 0018 0000  ................
	0x0010:  002c 0000 0000 0000 0000 0000 0000 0000  .,..............
	0x0020:  0084 784b 876f 9b5f 776c 3000 0000 0000  ..xK.o._wl0.....
	0x0030:  0000                                     ..
.................,................xK.o._wl0.......
17:07:35.023624 d6:7b:b0:7a:2e:6d (oui Unknown) > d4:7b:b0:7a:2e:6d (oui Unknown), ethertype Unknown (0x886c), length 199: 
	0x0000:  8001 00e5 0000 1018 0001 0002 0018 0000  ................
	0x0010:  002c 0000 0000 0000 0000 0000 0000 0000  .,..............
	0x0020:  007d 784b 876f 9b5f 776c 3000 0000 0000  .}xK.o._wl0.....
	0x0030:  0000                                     ..
.................,...............}xK.o._wl0.......
17:07:35.025110 d6:7b:b0:7a:2e:6d (oui Unknown) > d4:7b:b0:7a:2e:6d (oui Unknown), ethertype Unknown (0x886c), length 196: 
	0x0000:  8001 00e2 0000 1018 0001 0002 0018 0000  ................
	0x0010:  002c 0000 0000 0000 0000 0000 0000 0000  .,..............
	0x0020:  007a 784b 876f 9b5f 776c 3000 0000 0000  .zxK.o._wl0.....
	0x0030:  0000                                     ..
.................,...............zxK.o._wl0.......
17:07:35.026394 d6:7b:b0:7a:2e:6d (oui Unknown) > d4:7b:b0:7a:2e:6d (oui Unknown), ethertype Unknown (0x886c), length 189: 
	0x0000:  8001 00db 0000 1018 0001 0002 0018 0000  ................
	0x0010:  002c 0000 0000 0000 0000 0000 0000 0000  .,..............
	0x0020:  0073 784b 876f 9b5f 776c 3000 0000 0000  .sxK.o._wl0.....
	0x0030:  0000                                     ..
.................,...............sxK.o._wl0.......
17:07:36.102333 IP 172.24.1.89.64742 > 172.24.1.1.domain: 39116+[|domain]
E..@...........Y.......5.,U..............mesu.g.aa
17:07:36.158413 IP 172.24.1.1.domain > 172.24.1.89.64742: 39116[|domain]
E..`..@.@..........Y.5...L ..............mesu.g.aa
17:07:36.205589 d6:7b:b0:7a:2e:6d (oui Unknown) > d4:7b:b0:7a:2e:6d (oui Unknown), ethertype Unknown (0x886c), length 116: 
	0x0000:  8001 0092 0000 1018 0001 0002 0018 0000  ................
	0x0010:  002c 0000 0000 0000 0000 0000 0000 0000  .,..............
	0x0020:  002a 9cb6 d00b dfe5 776c 3000 0000 0000  .*......wl0.....
	0x0030:  0000                                     ..
.................,...............*......wl0.......
17:07:36.422574 d6:7b:b0:7a:2e:6d (oui Unknown) > d4:7b:b0:7a:2e:6d (oui Unknown), ethertype Unknown (0x886c), length 116: 
	0x0000:  8001 0092 0000 1018 0001 0002 0018 0000  ................
	0x0010:  002c 0000 0000 0000 0000 0000 0000 0000  .,..............
	0x0020:  002a 9cb6 d00b dfe5 776c 3000 0000 0000  .*......wl0.....
	0x0030:  0000                                     ..
.................,...............*......wl0.......
17:07:36.440217 IP 172.24.1.89.54346 > ord37s09-in-f3.1e100.net.https: Flags [S], seq 1626816981, win 65535, options [mss 1460,nop,wscale 5,nop,nop,[|tcp]>
E..@..@.@......Y.....J..`.A.......................
17:07:36.440304 IP 172.24.1.89.54347 > usatl4-vip-bx-006.aaplimg.com.https: Flags [S], seq 2509985311, win 65535, options [mss 1460,nop,wscale 5,nop,nop,[|tcp]>
E..@.%@.@..V...Y.....K....V..........W............
17:07:36.440398 IP 172.24.1.89.54348 > usatl4-vip-bx-008.aaplimg.com.https: Flags [S], seq 1936588363, win 65535, options [mss 1460,nop,wscale 5,nop,nop,[|tcp]>
E..@I.@.@.)....Y.....L..sm.K.........N............
17:07:36.442786 d6:7b:b0:7a:2e:6d (oui Unknown) > d4:7b:b0:7a:2e:6d (oui Unknown), ethertype Unknown (0x886c), length 116: 
	0x0000:  8001 0092 0000 1018 0001 0002 0018 0000  ................
	0x0010:  002c 0000 0000 0000 0000 0000 0000 0000  .,..............
	0x0020:  002a 9cb6 d00b dfe5 776c 3000 0000 0000  .*......wl0.....
	0x0030:  0000                                     ..
.................,...............*......wl0.......
17:07:36.459313 IP 172.24.1.89.54349 > ord37s07-in-f36.1e100.net.https: Flags [S], seq 186883748, win 65535, options [mss 1460,nop,wscale 5,nop,nop,[|tcp]>
E..@CE@.@......Y...$.M...#........................
17:07:36.471003 IP ord37s09-in-f3.1e100.net.https > 172.24.1.89.54346: Flags [S.], seq 242248590, ack 1626816982, win 42408, options [mss 1380,sackOK,TS[|tcp]>
E..<z...5..#.......Y...J.pk.`.A.....)v.....d...
.K
17:07:36.482506 IP 172.24.1.89.54346 > ord37s09-in-f3.1e100.net.https: Flags [.], ack 1, win 4104, options [nop,nop,TS[|tcp]>
E..4..@.@..3...Y.....J..`.A..pk............
B.=..K
17:07:36.483175 IP 172.24.1.89.54346 > ord37s09-in-f3.1e100.net.https: Flags [P.], seq 1:224, ack 1, win 4104, options [nop,nop,TS[|tcp]>
E....m@.@..j...Y.....J..`.A..pk............
B.=..K
17:07:36.485404 IP ord37s07-in-f36.1e100.net.https > 172.24.1.89.54349: Flags [S.], seq 3895034858, ack 186883749, win 42408, options [mss 1380,sackOK,TS[|tcp]>
E..<....5.;h...$...Y...M.)...#......9......d...
..
17:07:36.488638 IP 172.24.1.89.54349 > ord37s07-in-f36.1e100.net.https: Flags [.], ack 1, win 4104, options [nop,nop,TS[|tcp]>
E..4.[@.@......Y...$.M...#...).............
B.>...
17:07:36.490064 IP 172.24.1.89.54349 > ord37s07-in-f36.1e100.net.https: Flags [P.], seq 1:225, ack 1, win 4104, options [nop,nop,TS[|tcp]>
E.....@.@.1....Y...$.M...#...).......1.....
B.>...
17:07:36.490662 IP usatl4-vip-bx-008.aaplimg.com.https > 172.24.1.89.54348: Flags [S.], seq 1463941349, ack 1936588364, win 14480, options [mss 1460,sackOK,TS[|tcp]>
E..<..@.4..~.......Y...LWA..sm.L..8..=.........
=N
17:07:36.490925 IP usatl4-vip-bx-006.aaplimg.com.https > 172.24.1.89.54347: Flags [S.], seq 2446486894, ack 2509985312, win 14480, options [mss 1460,sackOK,TS[|tcp]>
E..<..@.4..........Y...K..mn..V ..8.. .........
=)
17:07:36.494619 IP 172.24.1.89.54348 > usatl4-vip-bx-008.aaplimg.com.https: Flags [.], ack 1, win 4117, options [nop,nop,TS[|tcp]>
E..4pw@.@......Y.....L..sm.LWA.......K.....
B.>.=N
17:07:36.494778 IP 172.24.1.89.54347 > usatl4-vip-bx-006.aaplimg.com.https: Flags [.], ack 1, win 4117, options [nop,nop,TS[|tcp]>
E..4..@.@......Y.....K....V ..mo....H(.....
B.>.=)
17:07:36.494846 IP 172.24.1.89.54347 > usatl4-vip-bx-006.aaplimg.com.https: Flags [F.], seq 1, ack 1, win 4117, options [nop,nop,TS[|tcp]>
E..4].@.@......Y.....K....V ..mo....H&.....
B.>	=)
17:07:36.501794 IP 172.24.1.89.54348 > usatl4-vip-bx-008.aaplimg.com.https: Flags [P.], seq 1:257, ack 1, win 4117, options [nop,nop,TS[|tcp]>
E..4..@.@......Y.....L..sm.LWA.............
B.>.=N
17:07:36.509083 IP ord37s09-in-f3.1e100.net.https > 172.24.1.89.54346: Flags [.], ack 224, win 340, options [nop,nop,TS[|tcp]>
E..4z...5..........Y...J.pk.`.B....T.......
.K..B.
17:07:36.510511 IP ord37s09-in-f3.1e100.net.https > 172.24.1.89.54346: Flags [.], seq 1:1419, ack 224, win 340, options [nop,nop,TS[|tcp]>
E...z...5..........Y...J.pk.`.B....T.8.....
.K..B.
17:07:36.511120 IP ord37s09-in-f3.1e100.net.https > 172.24.1.89.54346: Flags [.], seq 1419:2837, ack 224, win 340, options [nop,nop,TS[|tcp]>
E...z...5..........Y...J.pq.`.B....T.......
.K..B.
17:07:36.511376 IP ord37s09-in-f3.1e100.net.https > 172.24.1.89.54346: Flags [.], seq 2837:4255, ack 224, win 340, options [nop,nop,TS[|tcp]>
E...z...5..........Y...J.pv.`.B....T.......
.K..B.
17:07:36.511475 IP ord37s09-in-f3.1e100.net.https > 172.24.1.89.54346: Flags [P.], seq 4255:4330, ack 224, win 340, options [nop,nop,TS[|tcp]>
E...z...5..........Y...J.p|-`.B....TA......
.K..B.
17:07:36.511653 IP ord37s07-in-f36.1e100.net.https > 172.24.1.89.54349: Flags [.], ack 225, win 340, options [nop,nop,TS[|tcp]>
E..4....5.;^...$...Y...M.)...#.....T
......
....B.
17:07:36.511967 IP ord37s07-in-f36.1e100.net.https > 172.24.1.89.54349: Flags [.], seq 1:1419, ack 225, win 340, options [nop,nop,TS[|tcp]>
E.......5.5....$...Y...M.)...#.....Tt$.....
....B.
17:07:36.512388 IP ord37s07-in-f36.1e100.net.https > 172.24.1.89.54349: Flags [.], seq 1419:2837, ack 225, win 340, options [nop,nop,TS[|tcp]>
E.......5.5....$...Y...M.).u.#.....T.=.....
....B.
17:07:36.513051 IP ord37s07-in-f36.1e100.net.https > 172.24.1.89.54349: Flags [P.], seq 2837:3785, ack 225, win 340, options [nop,nop,TS[|tcp]>
E.......5.7....$...Y...M.)...#.....Tl......
....B.
17:07:36.515514 IP 172.24.1.89.54346 > ord37s09-in-f3.1e100.net.https: Flags [.], ack 2837, win 4015, options [nop,nop,TS[|tcp]>
E..4&.@.@......Y.....J..`.B..pv......6.....
B.>..K
17:07:36.515602 IP 172.24.1.89.54346 > ord37s09-in-f3.1e100.net.https: Flags [.], ack 4330, win 4049, options [nop,nop,TS[|tcp]>
E..4..@.@......Y.....J..`.B..p|x.....>.....
B.>..K
17:07:36.515749 IP 172.24.1.89.54349 > ord37s07-in-f36.1e100.net.https: Flags [.], ack 2837, win 4015, options [nop,nop,TS[|tcp]>
E..40.@.@......Y...$.M...#...).......4.....
B.>...
17:07:36.515783 IP 172.24.1.89.54349 > ord37s07-in-f36.1e100.net.https: Flags [.], ack 3785, win 3985, options [nop,nop,TS[|tcp]>
E..4*.@.@......Y...$.M...#...).............
B.>...
17:07:36.517143 IP 172.24.1.89.54349 > ord37s07-in-f36.1e100.net.https: Flags [.], ack 3785, win 4096, options [nop,nop,TS[|tcp]>
E..4..@.@......Y...$.M...#...)......./.....
B.>...
17:07:36.537882 IP 172.24.1.89.54346 > ord37s09-in-f3.1e100.net.https: Flags [P.], seq 224:299, ack 4330, win 4096, options [nop,nop,TS[|tcp]>
E....F@.@.:%...Y.....J..`.B..p|x...........
B.>1.K
17:07:36.538529 IP 172.24.1.89.54346 > ord37s09-in-f3.1e100.net.https: Flags [P.], seq 299:305, ack 4330, win 4096, options [nop,nop,TS[|tcp]>
E..:7.@.@......Y.....J..`.C..p|x...........
B.>1.K
17:07:36.538614 IP 172.24.1.89.54346 > ord37s09-in-f3.1e100.net.https: Flags [P.], seq 305:350, ack 4330, win 4096, options [nop,nop,TS[|tcp]>
E..a+U@.@..4...Y.....J..`.C..p|x.....].....
B.>1.K
17:07:36.540580 IP usatl4-vip-bx-006.aaplimg.com.https > 172.24.1.89.54347: Flags [F.], seq 1, ack 2, win 57, options [nop,nop,TS[|tcp]>
E..4.1@.4..V.......Y...K..mo..V!...9W......
=).^B.
17:07:36.544588 IP 172.24.1.89.54349 > ord37s07-in-f36.1e100.net.https: Flags [P.], seq 225:300, ack 3785, win 4096, options [nop,nop,TS[|tcp]>
E.....@.@.Lh...Y...$.M...#...).......	.....
B.>6..
17:07:36.544754 IP 172.24.1.89.54349 > ord37s07-in-f36.1e100.net.https: Flags [P.], seq 300:306, ack 3785, win 4096, options [nop,nop,TS[|tcp]>
E..:j.@.@.t....Y...$.M...#...).............
B.>6..
17:07:36.544793 IP 172.24.1.89.54349 > ord37s07-in-f36.1e100.net.https: Flags [P.], seq 306:351, ack 3785, win 4096, options [nop,nop,TS[|tcp]>
E..a.0@.@......Y...$.M...#...)......XY.....
B.>6..
17:07:36.545378 IP 172.24.1.89.54347 > usatl4-vip-bx-006.aaplimg.com.https: Flags [.], ack 2, win 4117, options [nop,nop,TS[|tcp]>
E..4.E@.@..B...Y.....K....V!..mp....G......
B.>6=)
17:07:36.547118 IP usatl4-vip-bx-008.aaplimg.com.https > 172.24.1.89.54348: Flags [.], ack 257, win 61, options [nop,nop,TS[|tcp]>
E..4..@.4..........Y...LWA..sm.L...=.......
=NL5B.
17:07:36.547869 IP usatl4-vip-bx-008.aaplimg.com.https > 172.24.1.89.54348: Flags [.], seq 1:1449, ack 257, win 61, options [nop,nop,TS[|tcp]>
E.....@.4..	.......Y...LWA..sm.L...=.......
=NL5B.
17:07:36.550042 IP usatl4-vip-bx-008.aaplimg.com.https > 172.24.1.89.54348: Flags [.], seq 1449:2897, ack 257, win 61, options [nop,nop,TS[|tcp]>
E.....@.4..........Y...LWA..sm.L...=.1.....
=NL5B.
17:07:36.550431 IP usatl4-vip-bx-008.aaplimg.com.https > 172.24.1.89.54348: Flags [P.], seq 2897:4097, ack 257, win 61, options [nop,nop,TS[|tcp]>
E.....@.4..........Y...LWB.6sm.L...=,%.....
=NL5B.
17:07:36.550547 IP usatl4-vip-bx-008.aaplimg.com.https > 172.24.1.89.54348: Flags [P.], seq 4097:5194, ack 257, win 61, options [nop,nop,TS[|tcp]>
E..}..@.4..e.......Y...LWB..sm.L...=Yd.....
=NL7B.
17:07:36.555879 IP 172.24.1.89.54348 > usatl4-vip-bx-008.aaplimg.com.https: Flags [.], ack 2897, win 4050, options [nop,nop,TS[|tcp]>
E..4..@.@.~....Y.....L..sm.LWB.6...........
B.>A=N
17:07:36.555968 IP 172.24.1.89.54348 > usatl4-vip-bx-008.aaplimg.com.https: Flags [.], ack 4097, win 4013, options [nop,nop,TS[|tcp]>
E..4.u@.@......Y.....L..sm.LWB.......A.....
B.>A=N
17:07:36.555995 IP 172.24.1.89.54348 > usatl4-vip-bx-008.aaplimg.com.https: Flags [.], ack 5194, win 4061, options [nop,nop,TS[|tcp]>
E..4..@.@......Y.....L..sm.LWB./...........
B.>A=N
17:07:36.561565 d6:7b:b0:7a:2e:6d (oui Unknown) > d4:7b:b0:7a:2e:6d (oui Unknown), ethertype Unknown (0x886c), length 184: 
	0x0000:  8001 00d6 0000 1018 0001 0002 0018 0000  ................
	0x0010:  002c 0000 0000 0000 0000 0000 0000 0000  .,..............
	0x0020:  006e 0023 a723 bbc9 776c 3000 0000 0000  .n.#.#..wl0.....
	0x0030:  0000                                     ..
.................,...............n.#.#..wl0.......
17:07:36.567494 IP ord37s07-in-f36.1e100.net.https > 172.24.1.89.54349: Flags [.], ack 306, win 340, options [nop,nop,TS[|tcp]>
E..4.$..5.;1...$...Y...M.)...#.....T.:.....
....B.
17:07:36.567649 IP ord37s09-in-f3.1e100.net.https > 172.24.1.89.54346: Flags [.], ack 350, win 340, options [nop,nop,TS[|tcp]>
E..4z...5..........Y...J.p|x`.C3...T.......
.K..B.
17:07:36.567878 IP ord37s09-in-f3.1e100.net.https > 172.24.1.89.54346: Flags [P.], seq 4330:4381, ack 350, win 340, options [nop,nop,TS[|tcp]>
E..gz...5..........Y...J.p|x`.C3...T.'.....
.K..B.
17:07:36.568026 IP ord37s09-in-f3.1e100.net.https > 172.24.1.89.54346: Flags [P.], seq 4381:4437, ack 350, win 340, options [nop,nop,TS[|tcp]>
E..lz...5..........Y...J.p|.`.C3...T?......
.K..B.
17:07:36.568122 IP ord37s09-in-f3.1e100.net.https > 172.24.1.89.54346: Flags [P.], seq 4437:4479, ack 350, win 340, options [nop,nop,TS[|tcp]>
E..^z...5..........Y...J.p|.`.C3...T.x.....
.K..B.
17:07:36.568210 IP ord37s07-in-f36.1e100.net.https > 172.24.1.89.54349: Flags [P.], seq 3785:3836, ack 351, win 340, options [nop,nop,TS[|tcp]>
E..g.%..5.:....$...Y...M.)...#.....T.o.....
....B.
17:07:36.568298 IP ord37s07-in-f36.1e100.net.https > 172.24.1.89.54349: Flags [P.], seq 3836:3892, ack 351, win 340, options [nop,nop,TS[|tcp]>
E..l.&..5.:....$...Y...M.)...#.....T.......
....B.
17:07:36.568382 IP ord37s07-in-f36.1e100.net.https > 172.24.1.89.54349: Flags [P.], seq 3892:3934, ack 351, win 340, options [nop,nop,TS[|tcp]>
E..^.'..5.;....$...Y...M.)...#.....Td......
....B.
17:07:36.571237 IP 172.24.1.89.54346 > ord37s09-in-f3.1e100.net.https: Flags [.], ack 4381, win 4094, options [nop,nop,TS[|tcp]>
E..4.v@.@.<@...Y.....J..`.C3.p|............
B.>P.K
17:07:36.571324 IP 172.24.1.89.54346 > ord37s09-in-f3.1e100.net.https: Flags [.], ack 4437, win 4092, options [nop,nop,TS[|tcp]>
E..4c.@.@.s....Y.....J..`.C3.p|............
B.>P.K
17:07:36.571399 IP 172.24.1.89.54346 > ord37s09-in-f3.1e100.net.https: Flags [.], ack 4479, win 4091, options [nop,nop,TS[|tcp]>
E..4.@@.@.<v...Y.....J..`.C3.p}............
B.>P.K
17:07:36.571468 IP 172.24.1.89.54349 > ord37s07-in-f36.1e100.net.https: Flags [.], ack 3836, win 4094, options [nop,nop,TS[|tcp]>
E..4rI@.@.m....Y...$.M...#...).............
B.>Q..
17:07:36.571538 IP 172.24.1.89.54349 > ord37s07-in-f36.1e100.net.https: Flags [.], ack 3892, win 4092, options [nop,nop,TS[|tcp]>
E..4..@.@..s...Y...$.M...#...).............
B.>Q..
17:07:36.571605 IP 172.24.1.89.54349 > ord37s07-in-f36.1e100.net.https: Flags [.], ack 3934, win 4091, options [nop,nop,TS[|tcp]>
E..4.d@.@......Y...$.M...#...).H...........
B.>Q..
17:07:36.585516 IP 172.24.1.89.54346 > ord37s09-in-f3.1e100.net.https: Flags [P.], seq 350:403, ack 4479, win 4096, options [nop,nop,TS[|tcp]>
E..ij.@.@.m|...Y.....J..`.C3.p}.....7......
B.>_.K
17:07:36.585609 IP 172.24.1.89.54346 > ord37s09-in-f3.1e100.net.https: Flags [P.], seq 403:453, ack 4479, win 4096, options [nop,nop,TS[|tcp]>
E..fq.@.@.e....Y.....J..`.Ch.p}.....+1.....
B.>_.K
17:07:36.585726 IP 172.24.1.89.54346 > ord37s09-in-f3.1e100.net.https: Flags [P.], seq 453:495, ack 4479, win 4096, options [nop,nop,TS[|tcp]>
E..^..@.@......Y.....J..`.C..p}............
B.>_.K
17:07:36.585856 IP 172.24.1.89.54346 > ord37s09-in-f3.1e100.net.https: Flags [P.], seq 495:1487, ack 4479, win 4096, options [nop,nop,TS[|tcp]>
E.....@.@......Y.....J..`.C..p}.....{}.....
B.>_.K
17:07:36.586775 IP 172.24.1.89.54349 > ord37s07-in-f36.1e100.net.https: Flags [P.], seq 351:404, ack 3934, win 4096, options [nop,nop,TS[|tcp]>
E..i..@.@.R....Y...$.M...#...).H...........
B.>_..
17:07:36.586867 IP 172.24.1.89.54349 > ord37s07-in-f36.1e100.net.https: Flags [P.], seq 404:454, ack 3934, win 4096, options [nop,nop,TS[|tcp]>
E..f3.@.@..&...Y...$.M...#.8.).H.....>.....
B.>_..
17:07:36.587722 IP 172.24.1.89.54349 > ord37s07-in-f36.1e100.net.https: Flags [P.], seq 454:496, ack 3934, win 4096, options [nop,nop,TS[|tcp]>
E..^..@.@..P...Y...$.M...#.j.).H.....?.....
B.>_..
17:07:36.587765 IP 172.24.1.89.54349 > ord37s07-in-f36.1e100.net.https: Flags [P.], seq 496:1437, ack 3934, win 4096, options [nop,nop,TS[|tcp]>
E.....@.@......Y...$.M...#...).H....^......
B.>_..
17:07:36.587791 IP 172.24.1.89.54346 > ord37s09-in-f3.1e100.net.https: Flags [P.], seq 1487:1525, ack 4479, win 4096, options [nop,nop,TS[|tcp]>
E..Z.z@.@.*....Y.....J..`.G..p}............
B.>_.K
17:07:36.587857 IP 172.24.1.89.54349 > ord37s07-in-f36.1e100.net.https: Flags [P.], seq 1437:1475, ack 3934, win 4096, options [nop,nop,TS[|tcp]>
E..Z..@.@..g...Y...$.M...#.A.).H...........
B.>_..
17:07:36.606559 IP ord37s07-in-f36.1e100.net.https > 172.24.1.89.54349: Flags [.], ack 454, win 340, options [nop,nop,TS[|tcp]>
E..4.J..5.;....$...Y...M.).H.#.j...T.......
..."B.
17:07:36.607120 IP ord37s07-in-f36.1e100.net.https > 172.24.1.89.54349: Flags [P.], seq 3934:3972, ack 454, win 340, options [nop,nop,TS[|tcp]>
E..Z.K..5.:....$...Y...M.).H.#.j...T.......
..."B.
17:07:36.607187 IP 172.24.1.89.54348 > usatl4-vip-bx-008.aaplimg.com.https: Flags [P.], seq 257:332, ack 5194, win 4096, options [nop,nop,TS[|tcp]>
E.....@.@..|...Y.....L..sm.LWB./.....^.....
B.>s=N
17:07:36.607311 IP 172.24.1.89.54348 > usatl4-vip-bx-008.aaplimg.com.https: Flags [P.], seq 332:338, ack 5194, win 4096, options [nop,nop,TS[|tcp]>
E..:..@.@......Y.....L..sm..WB./...........
B.>s=N
17:07:36.607869 IP 172.24.1.89.54348 > usatl4-vip-bx-008.aaplimg.com.https: Flags [P.], seq 338:383, ack 5194, win 4096, options [nop,nop,TS[|tcp]>
E..a.;@.@......Y.....L..sm..WB./.....I.....
B.>s=N
17:07:36.608158 IP ord37s07-in-f36.1e100.net.https > 172.24.1.89.54349: Flags [.], ack 1437, win 362, options [nop,nop,TS[|tcp]>
E..4.L..5.;	...$...Y...M.).n.#.A...j.......
...#B.
17:07:36.611111 IP 172.24.1.89.54349 > ord37s07-in-f36.1e100.net.https: Flags [.], ack 3972, win 4094, options [nop,nop,TS[|tcp]>
E..4..@.@.^<...Y...$.M...#.g.).n...........
B.>w..
17:07:36.612328 IP ord37s09-in-f3.1e100.net.https > 172.24.1.89.54346: Flags [.], ack 495, win 340, options [nop,nop,TS[|tcp]>
E..4z...5..........Y...J.p}.`.C....T.m.....
.K.#B.
17:07:36.612626 IP ord37s09-in-f3.1e100.net.https > 172.24.1.89.54346: Flags [P.], seq 4479:4517, ack 495, win 340, options [nop,nop,TS[|tcp]>
E..Zz...5..........Y...J.p}.`.C....T.......
.K.#B.
17:07:36.614526 IP ord37s09-in-f3.1e100.net.https > 172.24.1.89.54346: Flags [.], ack 1525, win 362, options [nop,nop,TS[|tcp]>
E..4z...5..........Y...J.p}3`.G....j.(.....
.K.&B.
17:07:36.615512 IP 172.24.1.89.54346 > ord37s09-in-f3.1e100.net.https: Flags [.], ack 4517, win 4094, options [nop,nop,TS[|tcp]>
E..4..@.@......Y.....J..`.G..p}3.....{.....
B.>{.K
17:07:36.625267 IP ord37s07-in-f36.1e100.net.https > 172.24.1.89.54349: Flags [P.], seq 3972:4150, ack 1475, win 362, options [nop,nop,TS[|tcp]>
E....V..5.:M...$...Y...M.).n.#.g...j.......
...5B.
17:07:36.625576 IP ord37s07-in-f36.1e100.net.https > 172.24.1.89.54349: Flags [P.], seq 4150:4196, ack 1475, win 362, options [nop,nop,TS[|tcp]>
E..b.W..5.:....$...Y...M.). .#.g...j.......
...5B.
17:07:36.630157 IP 172.24.1.89.54349 > ord37s07-in-f36.1e100.net.https: Flags [.], ack 4150, win 4090, options [nop,nop,TS[|tcp]>
E..4..@.@......Y...$.M...#.g.). .....
.....
B.>...
17:07:36.630246 IP 172.24.1.89.54349 > ord37s07-in-f36.1e100.net.https: Flags [.], ack 4196, win 4089, options [nop,nop,TS[|tcp]>
E..4..@.@......Y...$.M...#.g.).N...........
B.>...
17:07:36.630327 IP 172.24.1.89.54349 > ord37s07-in-f36.1e100.net.https: Flags [P.], seq 1475:1521, ack 4196, win 4096, options [nop,nop,TS[|tcp]>
E..b*c@.@......Y...$.M...#.g.).N.....).....
B.>...
17:07:36.653835 IP usatl4-vip-bx-008.aaplimg.com.https > 172.24.1.89.54348: Flags [.], ack 383, win 61, options [nop,nop,TS[|tcp]>
E..4..@.4..........Y...LWB./sm.....=.M.....
=NL.B.
17:07:36.654153 IP usatl4-vip-bx-008.aaplimg.com.https > 172.24.1.89.54348: Flags [P.], seq 5194:5245, ack 383, win 61, options [nop,nop,TS[|tcp]>
E..g..@.4..y.......Y...LWB./sm.....=~M.....
=NL.B.
17:07:36.658204 IP 172.24.1.89.54348 > usatl4-vip-bx-008.aaplimg.com.https: Flags [.], ack 5245, win 4094, options [nop,nop,TS[|tcp]>
E..4b.@.@......Y.....L..sm..WB.b.....).....
B.>.=N
17:07:36.664983 d6:7b:b0:7a:2e:6d (oui Unknown) > d4:7b:b0:7a:2e:6d (oui Unknown), ethertype Unknown (0x886c), length 184: 
	0x0000:  8001 00d6 0000 1018 0001 0002 0018 0000  ................
	0x0010:  002c 0000 0000 0000 0000 0000 0000 0000  .,..............
	0x0020:  006e 0023 a723 bbc9 776c 3000 0000 0000  .n.#.#..wl0.....
	0x0030:  0000                                     ..
.................,...............n.#.#..wl0.......
17:07:36.666383 IP 172.24.1.89.54348 > usatl4-vip-bx-008.aaplimg.com.https: Flags [P.], seq 383:742, ack 5245, win 4096, options [nop,nop,TS[|tcp]>
E.....@.@..+...Y.....L..sm..WB.b....Jp.....
B.>.=N
17:07:36.690840 IP ord37s07-in-f36.1e100.net.https > 172.24.1.89.54349: Flags [.], ack 1521, win 362, options [nop,nop,TS[|tcp]>
E..4....5.:....$...Y...M.).N.#.....j.......
...vB.
17:07:36.702260 IP ord37s09-in-f3.1e100.net.https > 172.24.1.89.54346: Flags [P.], seq 4517:4766, ack 1525, win 362, options [nop,nop,TS[|tcp]>
E..-{...5..........Y...J.p}3`.G....j.......
.K.}B.
17:07:36.702571 IP ord37s09-in-f3.1e100.net.https > 172.24.1.89.54346: Flags [P.], seq 4766:4812, ack 1525, win 362, options [nop,nop,TS[|tcp]>
E..b{...5..z.......Y...J.p~,`.G....j.m.....
.K.}B.
17:07:36.706641 IP 172.24.1.89.54346 > ord37s09-in-f3.1e100.net.https: Flags [.], ack 4766, win 4088, options [nop,nop,TS[|tcp]>
E..4..@.@.L....Y.....J..`.G..p~,...........
B.>..K
17:07:36.706758 IP 172.24.1.89.54346 > ord37s09-in-f3.1e100.net.https: Flags [.], ack 4812, win 4086, options [nop,nop,TS[|tcp]>
E..4..@.@......Y.....J..`.G..p~Z...........
B.>..K
17:07:36.706862 IP 172.24.1.89.54346 > ord37s09-in-f3.1e100.net.https: Flags [P.], seq 1525:1571, ack 4812, win 4096, options [nop,nop,TS[|tcp]>
E..b.|@.@.P....Y.....J..`.G..p~Z.....	.....
B.>..K
17:07:36.713857 IP usatl4-vip-bx-008.aaplimg.com.https > 172.24.1.89.54348: Flags [P.], seq 5245:5530, ack 742, win 65, options [nop,nop,TS[|tcp]>
E..Q..@.4..........Y...LWB.bsn.1...A.b.....
=NL.B.
17:07:36.716601 IP 172.24.1.89.54348 > usatl4-vip-bx-008.aaplimg.com.https: Flags [.], ack 5530, win 4087, options [nop,nop,TS[|tcp]>
E..4..@.@......Y.....L..sn.1WB.......8.....
B.>.=N
17:07:36.722319 d6:7b:b0:7a:2e:6d (oui Unknown) > d4:7b:b0:7a:2e:6d (oui Unknown), ethertype Unknown (0x886c), length 116: 
	0x0000:  8001 0092 0000 1018 0001 0002 0018 0000  ................
	0x0010:  002c 0000 0000 0000 0000 0000 0000 0000  .,..............
	0x0020:  002a 9cb6 d00b dfe5 776c 3000 0000 0000  .*......wl0.....
	0x0030:  0000                                     ..
.................,...............*......wl0.......
17:07:36.737912 IP 172.24.1.89.54350 > ord37s08-in-f1.1e100.net.https: Flags [S], seq 3747157752, win 65535, options [mss 1460,nop,wscale 5,nop,nop,[|tcp]>
E..@0Q@.@..{...Y.....N...Y........................
17:07:36.744361 d6:7b:b0:7a:2e:6d (oui Unknown) > d4:7b:b0:7a:2e:6d (oui Unknown), ethertype Unknown (0x886c), length 116: 
	0x0000:  8001 0092 0000 1018 0001 0002 0018 0000  ................
	0x0010:  002c 0000 0000 0000 0000 0000 0000 0000  .,..............
	0x0020:  002a 9cb6 d00b dfe5 776c 3000 0000 0000  .*......wl0.....
	0x0030:  0000                                     ..
.................,...............*......wl0.......
17:07:36.766086 d6:7b:b0:7a:2e:6d (oui Unknown) > d4:7b:b0:7a:2e:6d (oui Unknown), ethertype Unknown (0x886c), length 116: 
	0x0000:  8001 0092 0000 1018 0001 0002 0018 0000  ................
	0x0010:  002c 0000 0000 0000 0000 0000 0000 0000  .,..............
	0x0020:  002a 9cb6 d00b dfe5 776c 3000 0000 0000  .*......wl0.....
	0x0030:  0000                                     ..
.................,...............*......wl0.......
17:07:36.772109 IP ord37s08-in-f1.1e100.net.https > 172.24.1.89.54350: Flags [S.], seq 1039428025, ack 3747157753, win 42408, options [mss 1380,sackOK,TS[|tcp]>
E..<fX..5..x.......Y...N=.i..Y......M-.....d...
.C
17:07:36.773181 IP ord37s09-in-f3.1e100.net.https > 172.24.1.89.54346: Flags [.], ack 1571, win 362, options [nop,nop,TS[|tcp]>
E..4{K..5..k.......Y...J.p~Z`.G....j.......
.K..B.
17:07:36.773635 IP 172.24.1.89.54350 > ord37s08-in-f1.1e100.net.https: Flags [.], ack 1, win 4104, options [nop,nop,TS[|tcp]>
E..4>.@.@......Y.....N...Y..=.i......&.....
B.?..C
17:07:36.776139 IP 172.24.1.89.54350 > ord37s08-in-f1.1e100.net.https: Flags [P.], seq 1:229, ack 1, win 4104, options [nop,nop,TS[|tcp]>
E...)<@.@......Y.....N...Y..=.i............
B.?..C
17:07:36.806879 d6:7b:b0:7a:2e:6d (oui Unknown) > d4:7b:b0:7a:2e:6d (oui Unknown), ethertype Unknown (0x886c), length 116: 
	0x0000:  8001 0092 0000 1018 0001 0002 0018 0000  ................
	0x0010:  002c 0000 0000 0000 0000 0000 0000 0000  .,..............
	0x0020:  002a 9cb6 d00b dfe5 776c 3000 0000 0000  .*......wl0.....
	0x0030:  0000                                     ..
.................,...............*......wl0.......
17:07:36.809518 IP ord37s08-in-f1.1e100.net.https > 172.24.1.89.54350: Flags [.], ack 229, win 340, options [nop,nop,TS[|tcp]>
E..4fl..5..l.......Y...N=.i..Y.....T.......
.C..B.
17:07:36.814378 IP ord37s08-in-f1.1e100.net.https > 172.24.1.89.54350: Flags [.], seq 1:1419, ack 229, win 340, options [nop,nop,TS[|tcp]>
E...fm..5..........Y...N=.i..Y.....T.......
.C..B.
17:07:36.825108 IP ord37s08-in-f1.1e100.net.https > 172.24.1.89.54350: Flags [.], seq 1419:2837, ack 229, win 340, options [nop,nop,TS[|tcp]>
E...fn..5..........Y...N=.oD.Y.....Tt......
.C..B.
17:07:36.825630 IP ord37s08-in-f1.1e100.net.https > 172.24.1.89.54350: Flags [.], seq 2837:4255, ack 229, win 340, options [nop,nop,TS[|tcp]>
E...fo..5..........Y...N=.t..Y.....T=......
.C..B.
17:07:36.828105 IP 172.24.1.89.54350 > ord37s08-in-f1.1e100.net.https: Flags [.], ack 2837, win 4051, options [nop,nop,TS[|tcp]>
E..4..@.@.6....Y.....N...Y..=.t............
B.?I.C
17:07:36.831929 IP ord37s08-in-f1.1e100.net.https > 172.24.1.89.54350: Flags [.], seq 4255:5673, ack 229, win 340, options [nop,nop,TS[|tcp]>
E...fp..5..........Y...N=.zX.Y.....T.......
.C..B.
17:07:36.832135 IP ord37s08-in-f1.1e100.net.https > 172.24.1.89.54350: Flags [P.], seq 5673:5942, ack 229, win 340, options [nop,nop,TS[|tcp]>
E..Afq..5..Z.......Y...N=....Y.....T.8.....
.C..B.
17:07:36.837304 IP 172.24.1.89.54350 > ord37s08-in-f1.1e100.net.https: Flags [.], ack 5673, win 4007, options [nop,nop,TS[|tcp]>
E..4@.@.@..7...Y.....N...Y..=..............
B.?R.C
17:07:36.837379 IP 172.24.1.89.54350 > ord37s08-in-f1.1e100.net.https: Flags [.], ack 5942, win 3998, options [nop,nop,TS[|tcp]>
E..4^I@.@.y....Y.....N...Y..=..............
B.?R.C
17:07:36.837451 IP 172.24.1.89.54350 > ord37s08-in-f1.1e100.net.https: Flags [.], ack 5942, win 4096, options [nop,nop,TS[|tcp]>
E..40h@.@..p...Y.....N...Y..=..............
B.?R.C
17:07:36.853104 IP 172.24.1.89.54350 > ord37s08-in-f1.1e100.net.https: Flags [P.], seq 229:304, ack 5942, win 4096, options [nop,nop,TS[|tcp]>
E.....@.@......Y.....N...Y..=.......t......
B.?b.C
